{
  "schema_version": "1.0.0",
  "nodes": [
    {
      "capability_id": "agent-acting",
      "layer": "agent",
      "independent": false
    },
    {
      "capability_id": "agent-agent",
      "layer": "agent",
      "independent": false
    },
    {
      "capability_id": "agent-context-config",
      "layer": "agent",
      "independent": false
    },
    {
      "capability_id": "agent-exit",
      "layer": "agent",
      "independent": false
    },
    {
      "capability_id": "agent-injection-config",
      "layer": "agent",
      "independent": false
    },
    {
      "capability_id": "agent-model-config",
      "layer": "agent",
      "independent": false
    },
    {
      "capability_id": "agent-re-act-config",
      "layer": "agent",
      "independent": false
    },
    {
      "capability_id": "agent-reasoning",
      "layer": "agent",
      "independent": false
    },
    {
      "capability_id": "agent-summary-schema",
      "layer": "agent",
      "independent": false
    },
    {
      "capability_id": "agentscope-logger",
      "layer": "foundation",
      "independent": true
    },
    {
      "capability_id": "agentscope-set-id-factory",
      "layer": "foundation",
      "independent": true
    },
    {
      "capability_id": "agentscope-set-timestamp-factory",
      "layer": "foundation",
      "independent": true
    },
    {
      "capability_id": "agentscope-setup-logger",
      "layer": "foundation",
      "independent": true
    },
    {
      "capability_id": "app-agent-middleware-factory",
      "layer": "extended",
      "independent": false
    },
    {
      "capability_id": "app-agent-tool-factory",
      "layer": "extended",
      "independent": false
    },
    {
      "capability_id": "app-event-projector",
      "layer": "extended",
      "independent": false
    },
    {
      "capability_id": "app-sub-agent-template",
      "layer": "extended",
      "independent": false
    },
    {
      "capability_id": "app-create-app",
      "layer": "extended",
      "independent": false
    },
    {
      "capability_id": "app-enqueue-index-task",
      "layer": "extended",
      "independent": false
    },
    {
      "capability_id": "app-enqueue-run-trigger",
      "layer": "extended",
      "independent": false
    },
    {
      "capability_id": "app-get-background-task-manager",
      "layer": "extended",
      "independent": false
    },
    {
      "capability_id": "app-get-blob-store",
      "layer": "extended",
      "independent": false
    },
    {
      "capability_id": "app-get-chat-run-registry",
      "layer": "extended",
      "independent": false
    },
    {
      "capability_id": "app-get-chat-service",
      "layer": "extended",
      "independent": false
    },
    {
      "capability_id": "app-get-current-user-id",
      "layer": "extended",
      "independent": false
    },
    {
      "capability_id": "app-get-extra-agent-middlewares",
      "layer": "extended",
      "independent": false
    },
    {
      "capability_id": "app-get-extra-agent-tools",
      "layer": "extended",
      "independent": false
    },
    {
      "capability_id": "app-get-knowledge-base-manager",
      "layer": "extended",
      "independent": false
    },
    {
      "capability_id": "app-get-knowledge-base-service",
      "layer": "extended",
      "independent": false
    },
    {
      "capability_id": "app-get-knowledge-parsers",
      "layer": "extended",
      "independent": false
    },
    {
      "capability_id": "app-get-message-bus",
      "layer": "extended",
      "independent": false
    },
    {
      "capability_id": "app-get-resource-access-service",
      "layer": "extended",
      "independent": false
    },
    {
      "capability_id": "app-get-scheduler-manager",
      "layer": "extended",
      "independent": false
    },
    {
      "capability_id": "app-get-session-service",
      "layer": "extended",
      "independent": false
    },
    {
      "capability_id": "app-get-storage",
      "layer": "extended",
      "independent": false
    },
    {
      "capability_id": "app-get-workspace-manager",
      "layer": "extended",
      "independent": false
    },
    {
      "capability_id": "app-lifespan",
      "layer": "extended",
      "independent": false
    },
    {
      "capability_id": "app-publish-session-event",
      "layer": "extended",
      "independent": false
    },
    {
      "capability_id": "credential-anthropic-credential",
      "layer": "foundation",
      "independent": true
    },
    {
      "capability_id": "credential-credential-base",
      "layer": "foundation",
      "independent": true
    },
    {
      "capability_id": "credential-credential-factory",
      "layer": "foundation",
      "independent": true
    },
    {
      "capability_id": "credential-dash-scope-credential",
      "layer": "foundation",
      "independent": true
    },
    {
      "capability_id": "credential-deep-seek-credential",
      "layer": "foundation",
      "independent": true
    },
    {
      "capability_id": "credential-gemini-credential",
      "layer": "foundation",
      "independent": true
    },
    {
      "capability_id": "credential-moonshot-credential",
      "layer": "foundation",
      "independent": true
    },
    {
      "capability_id": "credential-ollama-credential",
      "layer": "foundation",
      "independent": true
    },
    {
      "capability_id": "credential-open-ai-credential",
      "layer": "foundation",
      "independent": true
    },
    {
      "capability_id": "credential-xai-credential",
      "layer": "foundation",
      "independent": true
    },
    {
      "capability_id": "embedding-dash-scope-embedding-model",
      "layer": "model",
      "independent": false
    },
    {
      "capability_id": "embedding-embedding-cache-base",
      "layer": "model",
      "independent": false
    },
    {
      "capability_id": "embedding-embedding-model-base",
      "layer": "model",
      "independent": false
    },
    {
      "capability_id": "embedding-embedding-model-card",
      "layer": "model",
      "independent": false
    },
    {
      "capability_id": "embedding-embedding-response",
      "layer": "model",
      "independent": false
    },
    {
      "capability_id": "embedding-embedding-usage",
      "layer": "model",
      "independent": false
    },
    {
      "capability_id": "embedding-file-embedding-cache",
      "layer": "model",
      "independent": false
    },
    {
      "capability_id": "embedding-gemini-embedding-model",
      "layer": "model",
      "independent": false
    },
    {
      "capability_id": "embedding-input-t",
      "layer": "model",
      "independent": false
    },
    {
      "capability_id": "embedding-ollama-embedding-model",
      "layer": "model",
      "independent": false
    },
    {
      "capability_id": "embedding-open-ai-embedding-model",
      "layer": "model",
      "independent": false
    },
    {
      "capability_id": "event-agent-event",
      "layer": "foundation",
      "independent": true
    },
    {
      "capability_id": "event-confirm-result",
      "layer": "foundation",
      "independent": true
    },
    {
      "capability_id": "event-custom-event",
      "layer": "foundation",
      "independent": true
    },
    {
      "capability_id": "event-data-block-delta-event",
      "layer": "foundation",
      "independent": true
    },
    {
      "capability_id": "event-data-block-end-event",
      "layer": "foundation",
      "independent": true
    },
    {
      "capability_id": "event-data-block-start-event",
      "layer": "foundation",
      "independent": true
    },
    {
      "capability_id": "event-event-base",
      "layer": "foundation",
      "independent": true
    },
    {
      "capability_id": "event-event-type",
      "layer": "foundation",
      "independent": true
    },
    {
      "capability_id": "event-exceed-max-iters-event",
      "layer": "foundation",
      "independent": true
    },
    {
      "capability_id": "event-external-execution-result-event",
      "layer": "foundation",
      "independent": true
    },
    {
      "capability_id": "event-hint-block-event",
      "layer": "foundation",
      "independent": true
    },
    {
      "capability_id": "event-model-call-end-event",
      "layer": "foundation",
      "independent": true
    },
    {
      "capability_id": "event-model-call-start-event",
      "layer": "foundation",
      "independent": true
    },
    {
      "capability_id": "event-reply-end-event",
      "layer": "foundation",
      "independent": true
    },
    {
      "capability_id": "event-reply-end-reason",
      "layer": "foundation",
      "independent": true
    },
    {
      "capability_id": "event-reply-finished-reason",
      "layer": "foundation",
      "independent": true
    },
    {
      "capability_id": "event-reply-start-event",
      "layer": "foundation",
      "independent": true
    },
    {
      "capability_id": "event-require-external-execution-event",
      "layer": "foundation",
      "independent": true
    },
    {
      "capability_id": "event-require-user-confirm-event",
      "layer": "foundation",
      "independent": true
    },
    {
      "capability_id": "event-text-block-delta-event",
      "layer": "foundation",
      "independent": true
    },
    {
      "capability_id": "event-text-block-end-event",
      "layer": "foundation",
      "independent": true
    },
    {
      "capability_id": "event-text-block-start-event",
      "layer": "foundation",
      "independent": true
    },
    {
      "capability_id": "event-thinking-block-delta-event",
      "layer": "foundation",
      "independent": true
    },
    {
      "capability_id": "event-thinking-block-end-event",
      "layer": "foundation",
      "independent": true
    },
    {
      "capability_id": "event-thinking-block-start-event",
      "layer": "foundation",
      "independent": true